<?xml version="1.0" encoding="UTF-8"?>
<tns:CardProvenance xmlns:tns="http://www.i2group.com/Schemas/2013-10-03/ModelData/Provenance" xmlns:xsi="http://www.w3.org/2001/XMLSchema-instance" xsi:schemaLocation="http://www.i2group.com/Schemas/2013-10-03/ModelData/Provenance schema1.xsd ">
  <OriginId Type="" Version="">
    <Key>
      <String>String</String>
    </Key>
  </OriginId>
  <RetrievalBlocks>
    <tns:RetrievalBlock>
      <Id Type="">
        <Key>
          <String>String</String>
        </Key>
      </Id>
      <RetrievalData/>
    </tns:RetrievalBlock>
  </RetrievalBlocks>
</tns:CardProvenance>
